product_slug,source_id,source_title,priority,local_pdf_status,local_pdf_path,packet_text_path,packet_snippet_path,extraction_status,extraction_note
infant-formula-powder-non-soy,almeida2022-brazil-infant-formula-toxic-metals,"Toxic Metals and Metalloids in Infant Formulas Marketed in Brazil, and Child Health Risks According to the Target Hazard Quotients and Target Cancer Risk",P0-extract-direct-product-values,local_pdf_found,"raw/studies/Toxic Metals and Metalloids in Infant Formulas Marketed in Brazil, and Child Health Risks According to the Target Hazard Quotients and Target Cancer Risk.pdf",data/evidence/local_reingest_packets/infant-formula-powder-non-soy/001-almeida2022-brazil-infant-formula-toxic-metals.txt,data/evidence/local_reingest_packets/infant-formula-powder-non-soy/001-almeida2022-brazil-infant-formula-toxic-metals.snippets.txt,text_extracted,
infant-formula-powder-non-soy,burrell2010-aluminium-in-infant-formulas,There is (still) too much aluminium in infant formulas,P0-extract-direct-product-values,local_pdf_found,../../../../Desktop/heavy-metal-index/raw/Digest/Added Manually /1471-2431-10-63.pdf,data/evidence/local_reingest_packets/infant-formula-powder-non-soy/002-burrell2010-aluminium-in-infant-formulas.txt,data/evidence/local_reingest_packets/infant-formula-powder-non-soy/002-burrell2010-aluminium-in-infant-formulas.snippets.txt,text_extracted,
infant-formula-powder-non-soy,chekri2019-french-infant-toddler-tds-trace-elements,Trace element contents in foods from the first French Total Diet Study on infants and toddlers,P0-extract-direct-product-values,local_pdf_found,../../../../Desktop/heavy-metal-index/raw/Digest/Added Manually /1-s2.0-S0889157518301868-am.pdf,data/evidence/local_reingest_packets/infant-formula-powder-non-soy/003-chekri2019-french-infant-toddler-tds-trace-elements.txt,data/evidence/local_reingest_packets/infant-formula-powder-non-soy/003-chekri2019-french-infant-toddler-tds-trace-elements.snippets.txt,text_extracted,
infant-formula-powder-non-soy,chuchu2013-aluminium-in-infant-formulas,The aluminium content of infant formulas remains too high,P0-extract-direct-product-values,local_pdf_found,../../../../Desktop/heavy-metal-index/raw/Digest/Added Manually /1471-2431-13-162.pdf,data/evidence/local_reingest_packets/infant-formula-powder-non-soy/004-chuchu2013-aluminium-in-infant-formulas.txt,data/evidence/local_reingest_packets/infant-formula-powder-non-soy/004-chuchu2013-aluminium-in-infant-formulas.snippets.txt,text_extracted,
infant-formula-powder-non-soy,chung2021-china-infant-formula-toxic-elements,Content and Dietary Exposure Assessment of Toxic Elements in Infant Formulas from the Chinese Market,P0-extract-direct-product-values,local_pdf_found,raw/studies/Content and Dietary Exposure Assessment of Toxic Elements in Infant Formulas from the Chinese Market.pdf,data/evidence/local_reingest_packets/infant-formula-powder-non-soy/005-chung2021-china-infant-formula-toxic-elements.txt,data/evidence/local_reingest_packets/infant-formula-powder-non-soy/005-chung2021-china-infant-formula-toxic-elements.snippets.txt,text_extracted,
infant-formula-powder-non-soy,collado-lopez2025-heavy-metals-baby-food-formula,Concentrations of Heavy Metals in Processed Baby Foods and Infant Formulas Worldwide: A Scoping Review,P0-extract-direct-product-values,local_pdf_found,../../../../Desktop/heavy-metal-index/raw/studies/nuaf138.pdf,data/evidence/local_reingest_packets/infant-formula-powder-non-soy/006-collado-lopez2025-heavy-metals-baby-food-formula.txt,data/evidence/local_reingest_packets/infant-formula-powder-non-soy/006-collado-lopez2025-heavy-metals-baby-food-formula.snippets.txt,text_extracted,
infant-formula-powder-non-soy,dabeka1987-canada-infant-formula-lead-cadmium,"Lead, cadmium, and fluoride levels in market milk and infant formulas in Canada",P0-extract-direct-product-values,local_pdf_found,raw/studies/dabeka1987.pdf,data/evidence/local_reingest_packets/infant-formula-powder-non-soy/007-dabeka1987-canada-infant-formula-lead-cadmium.txt,data/evidence/local_reingest_packets/infant-formula-powder-non-soy/007-dabeka1987-canada-infant-formula-lead-cadmium.snippets.txt,text_extracted,
infant-formula-powder-non-soy,fsa2016-infant-food-formula-metals-survey,"Survey of metals in commercial infant foods, infant formula and non-infant specific foods",P0-extract-direct-product-values,local_pdf_found,raw/studies/FS102048 Infants metal survey FSIS pdf version.pdf,data/evidence/local_reingest_packets/infant-formula-powder-non-soy/008-fsa2016-infant-food-formula-metals-survey.txt,data/evidence/local_reingest_packets/infant-formula-powder-non-soy/008-fsa2016-infant-food-formula-metals-survey.snippets.txt,text_extracted,
